,English,Vietnamese,Tamil Translation,Spanish,Hindi,Malay,Arabic,Portuguese,Swahili,Russian,French,Filipino,Thai,INDONESIAN,Nepali,Bengali,Chinese (Simplified),Chinese (Traditional),Khmer
delete_report_confirmation,Are you sure you want to delete report?,Bạn có chắc chắn muốn xóa báo cáo không?,அறிக்கையை நிச்சயமாக நீக்க விரும்புகிறீர்களா?,Está seguro que quiere borrar este reporte?,क्या आप ये रिपोर्ट डिलीट करना चाहते हैं?,Adakah anda pasti anda ingin memadam laporan?,هل انته متاكد من حذف هذا التقرير؟,Tem a certeza que pretende eliminar este evento?,Una hakika ungetaka kufuta hii ripoti ?,"Вы уверены, что хотите удалить отчет?",Êtes-vous sûr de vouloir supprimer ce rapport?,Sigurado kabang gusto mong burahin ang report?,คุณแน่ใจว่าต้องการลบการรายงานหรือไม่?,Apakah anda yakin ingin menghapus laporan?,के तपाईं रिपोर्ट मेट्न चाहनुहुन्छ ?,আপনি কি নিশ্চিত যে আপনি এই রিপোর্টটি মুছে ফেলতে চান? ,确定要删除报告？,確定要刪除報告？,តើអ្នកប្រាកដជាចង់លុបរបាយការណ៍មែនទេ?
cancel_,Cancel,Hủy,ரத்து செய்யவும்,Cancelar,कैंसल,Batal,الغاء,Cancelar,Sitisha,Отмена,Annuler,Kanselahin,ยกเลิก,Batalkan,रद्द गर्नुहोस्,বাতিল ,取消,取消,បោះបង់
ok,OK,OK,சரி,De acuerdo,ओके,OK,OK,OK,OK,OK,D\'accord,OK,ตกลง,OK,हुन्छ,ঠিক আছে ,确定,確定,យល់ព្រម
   <!--Map Page -->,   <!--Map Page -->,   <!--Map Page -->,   <!--Map Page -->,   <!--Map Page -->,   <!--Map Page -->,   <!--Map Page -->,   <!--Map Page -->,   <!--Map Page -->,   <!--Map Page -->,   <!--Map Page -->,   <!--Map Page -->,   <!--Map Page -->,   <!--Map Page -->,   <!--Map Page -->,   <!--Map Page -->,   <!--Map Page -->,   <!--Map Page -->,   <!--Map Page -->,   <!--Map Page -->
map,Map,Bản đồ,வரைபடம்,Mapa,नक्शा,Peta,خريطة,Mapa,Ramani,карта,Carte,Mapa,แผนที่,Peta,नक्सा,ম্যাপ ,地图,地圖,ផែនទី
layers,Layers,Lớp,அடுக்குகள்,Capas,परतें,Lapisan,طبقات,Camadas,Vipande,Слои,Couches,Mga Layer,เลเยอร์,Lapisan,लेयर,স্তরসমূহ ,图层,圖層,ស្រទាប់
map_layers,Map Layers,Lớp bản đồ,வரைபட அடுக்குகள்,Capas de mapa,नक्शा परतें,Lapisan peta,طبقات الخريطة,Camadas do mapa,Vipande vya Ramani,Слои карты,Couches de carte,Mga layer ng mapa,เลเยอร์แผนที่,Lapisan Peta,नक्सा लेयरहरु,ম্যাপের স্তরসমূহ ,地图图层,地圖圖層,ស្រទាប់ផែនទី
map_vectors,Map vectors,Bản đồ vectơ,வரைபட திசையன்கள்,Vectores del mapa,मैप वेक्टर,Peta Vektor,متجهات الخريطة,Vetores do mapa,Vecta za ramani,Векторы карты,Vecteurs de carte,Mga vectors ng mapa,แผนที่เวกเตอร์,Vektor Peta,मानचित्र भेक्टर,মানচিত্রের ভেক্টর,地图向量,地圖向量,ផែនទីវ៉ិចទ័រ
initiate_downloading_offline_map,No map found! Downloading..,Không tìm thấy bản đồ nào! Đang tải xuống ..,வரைபடம் எதுவும் இல்லை! பதிவிறக்குகிறது ..,¡Ningún mapa encontrado! Descargando ..,कोई नक्शा नहीं मिला! डाउनलोड कर रहा है ..,Tiada peta dijumpai! muat turun ..,لم يتم العثور على خريطة! جارى التحميل..,Nenhum mapa encontrado! A transferir...,Hakuna ramani iliyopatikana! Inapakua ..,Карта не найдена! загрузка ..,Aucune carte trouvée! Téléchargement,Walang nakitang mapa! Nagda-download..,ไม่พบแผนที่! กำลังดาวน์โหลด..,Peta tidak ditemukan! Mengunduh..,कुनै नक्सा भेटिएन ! डाउनलोड गर्दै..,কোন ম্যাপ খুজে পাওয়া যায়নি! ডাউনলোড করা হচ্ছে ...,找不到地图！ 正在下载…,找不到地圖！ 正在下載…,រកមិនឃើញផែនទីទេ! កំពុងទាញយក…
internet_conection_needed_map,An Internet connection is needed to download map. Switch on WIFI or Mobile Data.,Cần có kết nối Internet để tải bản đồ. Bật WIFI hoặc Dữ liệu di động.,வரைபடத்தைப் பதிவிறக்க இணைய இணைப்பு தேவை. WIFI அல்லது மொபைல் தரவை மாற்றவும்.,Se necesita una conexión a Internet para descargar el mapa. Encienda WIFI o datos móviles,सिंक करने के लिए डेटा या वाई फाई की ज़रूरत है. आगे बढे?,Sambungan Internet diperlukan untuk memuat turun peta. Hidupkan WIFI atau data mudah alih.,هناك حاجة إلى اتصال بالإنترنت لتحميل الخريطة. قم بتشغيل WIFI أو بيانات الجوال.,É necessária uma ligação à Internet para transferir o mapa. Ligue o WiFi ou os dados móveis.,Uunganisho wa intaneti unahitaji kupakua ramani. Badilisha kwenye WIFI au Data ya Mkono.,Для загрузки карты необходимо подключение к Интернету. Включите WIFI или мобильные данные.,Une connexion Internet est nécessaire pour télécharger la carte. Activez le WIFI ou les données mobiles,Kailangan ng koneksyon sa Internet para ma-download ang mapa. Kumonekta sa WIFI o Mobile Data.,การเชื่อมต่ออินเตอร์เน็ตจำเป็นสำหรับการดาวน์โหลดแผนที่ เปิดใช้งาน WIFI หรืออินเตอร์เน็ตมือถือ,Koneksi Internet dibutuhkan untuk mengunduh peta. Aktifkan WIFI atau Data Seluler.,नक्सा डाउनलोड गर्न एउटा इन्टरनेट कनेस्क्सन आवश्यक हुन्छ l वाइफाई अन गर्नुहोस् वा मोबाइल डाटा अन गर्नुहोस् l,ম্যাপ ডাউনলোড করার জন্য একটি ইন্টারনেট সংযোগ প্রয়োজন। ওয়াই-ফাই বা আপনার মোবাইল ডাটা চালু করুন। ,下载地图需要连接互联网。请打开 WIFI 或移动数据。,下載地圖需要連接互聯網。請開啟 WIFI 或移動數據。,ត្រូវការភ្ជាប់អ៊ីនធឺណិតដើម្បីទាញយកផែនទី។ បើកវ៉ាយហ្វាយឬទិន្នន័យចល័ត។
downloading_maps_prompt,Downloading Offline Map,Đang tải bản đồ ngoại tuyến,ஆஃப்லைன் வரைபடத்தைப் பதிவிறக்குகிறது,Descargar el mapa sin conexión,ऑफ़लाइन मानचित्र डाउनलोड करना,Memuat turun peta luar talian,تحميل خريطة حاليا,Transferir mapa offline,Inapakua Ramani ya Nje,Загрузка автономной карты<,Téléchargement de la carte hors ligne,Nagda-download ang Offline Map,ดาวน์โหลดแผนที่ออฟไลน์,Mengunduh Peta Offline,अफलाइन नक्सा डाउनलोड गर्दै,অফলাইন ম্যাপ ডাউনলোড করা হচ্ছে …,下载离线地图,下載離線地圖,ទាញយកផែនទីក្រៅបណ្តាញទុក
currently_downloading_maps_prompt,Currently downloading offline Map,Đang tải bản đồ ngoại tuyến,தற்போது ஆஃப்லைன் வரைபடத்தைப் பதிவிறக்குகிறது,Actualmente descargando Mapa fuera de línea,वर्तमान में ऑफ़लाइन मानचित्र डाउनलोड कर रहा है,Kini memuat turun peta luar talian,حاليا تحميل خريطة حاليا,A transferir o mapa offline,Ramani ya nje ya mtandao inapakuliwa sasa hivi,В настоящее время загрузка офлайн-карты,En cours de téléchargement de la carte hors ligne,Kasalukuyang nagda-download ang Offline Map,กำลังทำการดาวน์โหลดแผนที่ออฟไลน์,Sedang mengunduh Peta offline,अहिले अफलाइन नक्सा डाउनलोड गर्दै,এখন অফলাইন ম্যাপ ডাউনলোড করা হচ্ছে ,目前正在下载离线地图,目前正在下載離線地圖,បច្ចុប្បន្នកំពុងទាញយកផែនទីក្រៅបណ្តាញទុក
close,close,gần,மூடுக,cerrar,बंद,menutup,أغلق,fechar,funga,закрывать,fermer,Isara,ปิด,tutup,नजिक,বন্ধ করা,关闭,關閉,បិត
 <!--Grievances Page -->, <!--Grievances Page -->, <!--Grievances Page -->, <!--Grievances Page -->, <!--Grievances Page -->, <!--Grievances Page -->, <!--Grievances Page -->, <!--Grievances Page -->, <!--Grievances Page -->, <!--Grievances Page -->, <!--Grievances Page -->, <!--Grievances Page -->, <!--Grievances Page -->, <!--Grievances Page -->, <!--Grievances Page -->, <!--Grievances Page -->, <!--Grievances Page -->, <!--Grievances Page -->, <!--Grievances Page -->, <!--Grievances Page -->
add_grievance_title,Would you like to add a new report or file a grievance ?,Bạn có muốn thêm một báo cáo mới hoặc nộp đơn khiếu nại không?,புதிய அறிக்கையைச் சேர்க்க விரும்புகிறீர்களா அல்லது குறைகளைச் சமர்ப்பிக்க விரும்புகிறீர்களா?,¿Desea agregar un nuevo informe o presentar una queja?,क्या आप एक नई रिपोर्ट जोड़ना चाहेंगे या शिकायत दर्ज करना चाहेंगे?,Adakah anda ingin menambah laporan baru atau memfailkan aduan ?,هل ترغب في إضافة تقرير جديد أو شكوى؟,Gostaria de adicionar um novo evento ou fazer uma denúncia?,"Je, ungependa kuongeza ripoti mpya au malalamiko?",Вы хотите добавить новый отчет или подать жалобу?,Voulez-vous ajouter un nouveau rapport ou déposer un grief ?,Gusto mo bang magdagdag ng bagong ulat o maghain ng reklamo?,คุณต้องการเพิ่มรายงานใหม่หรือยื่นคำร้อง?,Apakah anda ingin menambah laporan atau arsip keluhan baru?,के तपाईं एउटा नयाँ रिपोर्ट थप्न चाहनुहुन्छ वा एउटा गुनासो दाखिला गर्न चाहनुहुन्छ ?,আপনি কি একটি নতুন রিপোর্ট যুক্ত করতে চান? অথবা কোন অভিযোগ দাখিল করতে চান? ,你要添加新报告还是提出申诉？,你要新增新報告還是提出申訴？,តើអ្នកចង់បន្ថែមរបាយការណ៍ថ្មី ឬរៀបចំបណ្តឹងសារទុក្ខ?
grievance,Grievance,Khiếu nại,குறை,Queja,शिकायत,Keluhan,شكوى,Denúncia,Malalamiko,обида,Grief,Reklamo,คำร้อง,Keluhan,गुनासो,অভিযোগ ,申诉,申訴,បណ្តឹងសារទុក្ខ
date_of_grievance,Date of Grievance,Ngày khiếu nại,குறை நடந்த தேதி,Fecha de reclamo %1$s,शिकायत की तारीख,Tarikh keluhan %1$s,تاريخ حدوث التظلم,Data de denúncia,Tarehe ya malalamiko,Дата подачи жалобы,Date du grie,Petsa ng reklamo,วันที่คำร้อง,Tanggal Keluhan,गुनासोको मिति,অভিযোগের তারিখ ,申诉日期,申訴日期,កាលបរិច្ឆេទនៃបណ្តឹងសារទុក្ខ
where_it_happened,Location where it happened,Địa điểm xảy ra,குறை நடந்த இடம்,Ubicación donde sucedió,स्थान जहां यह हुआ,Lokasi di mana ia berlaku,الموقع الذي حدث فيه التظلم,Local da ocorrência,Mahali ambapo ilitokea,"Место, где это произошло",Lieu où c\'est arrivé,Lokasyon kung saan ito nangyari,สถานที่เกิดเหตุ,Lokasi dimana itu terjadi,कहाँ घट्यो त्यसको ठेगाना,যেখানে এটি ঘটেছে তার লোকেশন ,发生位置,發生位置,ទីតាំងដែលវាកើតឡើង
grievance_date,Grievance Date %1$s,Ngày khiếu nại,குறை கொடுக்கப்பட்ட நாள்,Fecha de queja %1$s,शिकायत दिनांक% 1 $ s,Tarikh keluhan %1$s,تاريخ التظلم٪1$s,Data de denúncia %1$s,Tarehe ya Malalamiko  %1$s,Дата жалоб %1$s,Date du grie %1$s,Petsa ng reklamo %1$s,คำร้องวันที่ %1$s,Tanggal Keluhan %1$s,गुनासो मिति %1$s,অভিযোগের তারিখ %1$s ,申诉日期 %1$s,申訴日期 %1$s,កាលបរិច្ឆេទបណ្តឹង %1$s
select_sector_grievance,Select Type of Grievance,Chọn loại khiếu nại,குறையின் வகையை தேர்ந்தெடுங்கள்,Seleccionar tipo de reclamo,शिकायत का प्रकार चुनें,Pilih jenis keluhan,نوع التظلم,Seleccionar o tipo de denúncia,Chagua Aina ya Malalamiko,Выберите тип жалобы,Choisir le type de grief,Pumili ng uri ng reklamo,เลือกประเภทของคำร้อง,Pilih Tipe Keluhan,गुनासोको प्रकार रोज्नुहोस्,অভিযোগের ধরণ ,请选择申诉类别,請選擇申訴類別,ជ្រើសរើសប្រភេទនៃការតវ៉ា
report,Report,Báo cáo,அறிக்கை,Informe,रिपोर्ट,Laporan,أبلغ عن,Evento,Ripoti,отчет,Rapport,Ulat,รายงาน,Laporan,रिपोर्ट गर्नुहोस्,রিপোর্ট ,报告,報告,របាយការណ៍
select_urgency,Select Urgency,Chọn mức độ khẩn cấp,அவசரத்தைத் தேர்ந்தெடுக்கவும்,Seleccione Urgencia,आग्रह का चयन करें,Pilih segera,اختيار الاستعجال,Seleccionar a urgência,Chagua Uharaka,Выберите срочность,Sélectionnez urgence,Piliin ang pangangailangan ng agarang pagtugon,เลือกความเร่งด่วน,Pilih Urgensi,तत्कालिकता रोज्नुहोस्,আর্জেন্সি সিলেক্ট করুন ,选择紧急程度,選擇緊急程度,ជ្រើសរើសភាពបន្ទាន់
edit_grievance,Edit Grievance,Chỉnh sửa khiếu nại,குறை மாற்றம் செய்ய,Editar reclamo,शिकायत संपादित करें,Edit keluhan,تحرير التظلم,Editar denúncia,Badilisha malalamiko,Изменить жалобу,Modifier le grief,Baguhin ang reklamo,แก้ไขคำร้อง,Ubah Keluhan,गुनासो सम्पादन गर्नुहोस्,অভিযোগ সম্পাদনা করুন ,编辑申诉,編輯申訴,កែសម្រួលការតវ៉ា
add_grievance,Add Grievance,Thêm khiếu nại,குறைகளைச் சேர்க்கலாம்,Agregar reclamo,शिकायत जोड़ें,Tambah keluhan,أضف شكوى,Adicionar denúncia,Ongeza malalamiko,Добавить жалобу,Ajouter un grief,Magdagdag ng reklamo,เพิ่มคำร้อง,Tambah Keluhan,गुनासो राख्नुहोस्,অভিযোগ যুক্ত করুন ,添加申诉,新增申訴,បន្ថែមការតវ៉ា
sync_grievance,Sync Grievance to Server,Đồng bộ hóa khiếu nại với máy chủ,குறையை சேவையகத்திற்கு ஒத்திசைவு சேர்க்க,Sincronizar queja al servidor,सर्वर से सिंक की शिकायत,Menyegerakkan keluhan kepada pelayan,مزامنة التظلم إلى الخادم,Sincronizar denúncia com o servidor,Unganisha malalamiko kwa Seva,Синтаксическая жалоба на сервер,Synchroniser le grief avec le serveur,Pag-sync ang reklamo sa Server,ถ่ายโอนคำร้องไปยังเซิร์ฟเวอร์,Sinkronisasi Keluhan ke Server,सर्भरसँग गुनासो सिंक गर्नुहोस्,অভিযোগটিকে সার্ভারে সিনক্রোনাইজেশন করুন ,将申诉同步到服务器,將申訴同步到伺務器,ធ្វើសមកាលកម្មបណ្តឹងសារទុក្ខទៅស៊ើវើ
syncing_grievance_of,Syncing Grievance,Đang đồng bộ hóa khiếu nại với máy chủ,குறைகளை ஒத்திசைத்தல்,Sincronización de reclamo,शिकायत को समाप्‍त करना,Menyelaras keluhan,مزامنة التظلمات,Sincronizar denúncia,Unganisha malalamiko kwa Seva,Синхронизация жалобы,Synchronisation des griefs,Pag-sync ng reklamo,กำลังถ่ายโอนคำร้อง,Sinkronisasi Keluhan,गुनासो सिंक हुँदै,অভিযোগ সিনক্রোনাইজেশন করা হচ্ছে ,正在同步申诉,正在同步申訴,ធ្វើសមកាលកម្មបណ្តឹងសារទុក្ខ
grievance_status,What type of Grievance are you capturing?,Bạn đang chụp loại Khiếu Nại nào?,நீங்கள் எந்த வகை குறைகளை கையாளுகிறீர்கள்?,¿Qué tipo de queja o reclamo está presentando?,आप किस तरह की शिकायत दर्ज़ कर रहे हैं?,Apakah jenis Rungutan yang ingin dilaporkan?,ما نوع التظلم الذي تلتقطه؟,Que tipo de denúncia está a capturar?,Unachagua malalamishi ya aina gani?,Какой тип претензий вы фиксируете?,Quel type de grief capturez-vous?,Anong uri ng karaingan ang kinukuha mo?,คำร้องประเภทใดที่คุณกำลังบันทึก?,Tipe Keluhan apa yang anda dapatkan?,तपाईं कस्तो प्रकारको गुनासो कब्जा गर्दै हुनुहुन्छ ?,কোন ধরণের অভিযোগ আপনি দেখতে পাচ্ছেন? ,你的申诉类别属哪一项?,你的申訴類別屬哪一項?,តើប្រភេទនៃបណ្តឹងសារទុក្ខណាដែលអ្នកកំពុងថតទុក?
grievance_cannot_save,"Cannot save grievance without a valid grievance ID. Discard grievance
",Không thể lưu khiếu nại mà không có ID khiếu nại hợp lệ. Hủy bỏ khiếu nại,"சரியான குறைபாடு ஐடியின்றி, குறைகளைச் சேமிக்க முடியாது. குறைகளை விலக்கு",No se puede guardar el reclamo sin una ID de reclamo válido. Descartar el reclamo,बिना एक मान्य शिकायत आईडी के ग्रिएवांस / शिकायत सेव नहीं की जा सकती है। शिकायत को रद्द करें।,Tidak dapat menyimpan rungutan tanpa ID rungutan yang sah. Buang rungutan,لا يمكن حفظ التظلم بدون معرف التظلم صالح. تجاهل التظلم,Não é possível guardar uma denúncia sem um ID válido. Descartar denúncia,Haiwezi kuhifadhi malalamiko bila Kitambulisho halali. Kuondoa malalamiko?,Невозможно сохранить жалобу без действительного идентификатора жалобы. Отменить жалобу?,Cannot save grievance without a valid grievance ID. Discard grievance,Hindi makapag-save ng karaingan nang walang isang wastong ID ng karaingan. Itapon ang karaingan?,ไม่สามารถบันทึกคำร้องโดยปราศจากเลข ID คำร้องได้ ยกเลิกคำร้อง,Tidak bisa menyimpan keluhan tanpa ID keluhan yang valid. Buang keluhan,एउटा वैध गुनासो आइडी बिना गुनासो सेभ हुन सक्दैन l गुनासो पठाउन छोड्नुहोस्,বৈধ অভিযোগ আইডি না থাকার কারণে অভিযোগটি সেভ করা যায়নি। অভিযোগটি বাতিল করুন? ,申诉 ID 无效，无法保存申诉，请放弃申诉,申訴 ID 無效，無法保存申訴，請放棄申訴,មិនអាចរក្សាទុកបណ្តឹងសារទុក្ខបានទេបើគ្មានលេខសម្គាល់បណ្តឹងត្រឹមត្រូវ។ បោះបង់បណ្តឹងសារទុក្ខ
<!--Lessons Page -->,<!--Lessons Page -->,<!--Lessons Page -->,<!--Lessons Page -->,<!--Lessons Page -->,<!--Lessons Page -->,<!--Lessons Page -->,<!--Lessons Page -->,<!--Lessons Page -->,<!--Lessons Page -->,<!--Lessons Page -->,<!--Lessons Page -->,<!--Lessons Page -->,<!--Lessons Page -->,<!--Lessons Page -->,<!--Lessons Page -->,<!--Lessons Page -->,<!--Lessons Page -->,<!--Lessons Page -->,<!--Lessons Page -->
lessons_folder_error,Problem creating lessons folder,Sự cố khi tạo thư mục bài học,பாடங்கள் பக்கம் கோப்புறையை உருவாக்குவதில் சிக்கல்,Problema al crear la carpeta lecciones,गाइड फोल्डर बनाने में दिक्कत,Masalah mencipta folder tutorial,مشكلة في إنشاء مجلد الدروس,Problema ao criar a pasta das lições,Tatizo kuongeza masomo kwa simu,Проблема с созданием папки уроков,Probleme de creation dossier lecons,Nagkaproblema sa paglikha ng folder ng mga aralin,พบปัญหาในการสร้างแฟ้มวิดีโอสาธิตการใช้งาน,Folder bantuan pembuatan masalah,पाठहरुको फोल्डर बनाउँन समस्या,পাঠের ফোল্ডার তৈরি করতে সমস্যা দেখা দিচ্ছে ,创建课程活页夹时出现问题,創建課程文件夾時出現問題,មានបញ្ហាក្នុងការបង្កើតថតឯកសារមេរៀន
lessons_prompt,Lessons,Bài học,பாடங்கள்,Lecciones,गाइड,Tutorial,دروس,Lições,Mafunzo,Уроки,Cours,Mga Aralin,วิดีโอสาธิตการใช้งาน,Bantuan,पाठहरु,পাঠসমূহ ,课程,課程,មេរៀន
lessons_unzipping,Unzipping Lessons..,Giải nén bài học..,பாடங்கள் விரிவாக்க ..,Lecciones de descomprimir..,गाइड ज़िप फाइल से निकले जा रहें हैं,Membuka Zip Tutorial…,فك الدرس ..,A descomprimir lições…,Kufungua failifunge la Masomo..,Распаковка уроков,Lecons decompression de fichiers..,Ina-unzip ang Mga Aralin…,แตกไฟล์วิดีโอสาธิตการใช้งาน,Unzip Bantuan..,पाठहरु खोल्दै..,পাঠসমূহ আনজিপ করা হচ্ছে …,正在解压缩课程...,正在解壓縮課程...,ពន្លាមេរៀន ..
lessons_thumbnails,Generating thumbnails..,Đang tạo hình thu nhỏ ..,சிறு உருவங்களை உருவாக்குகிறது ..,Generando thumbnails..,थुम्ब्नेल बन रहें हैं,Menjana thumbnail…,توليد الصور المصغرة ..,A gerar miniaturas…,Kutengeneza picha za video,Создание эскизов,Generer des thumbnails..,Lumilikha ng mga thumbnail…,สร้างรูปประกอบ..,Membuat Thumbnail,थम्बनेलहरु बनाउँदै..,থাম্বনেইলসমূহ তৈরি করা হচ্ছে ... ,正在产生缩图…,正在產生縮圖…,កំពុងបង្កើតរូបភាពតំណាង
